Facet,Category,Definition,Score_1,Score_5,Few_Shot_Example
Conventional,Pragmatics,The tendency to adhere to social norms and conventions in conversation.,Very low adherence to social norms and conventions.,Extremely high adherence to social norms and conventions.,"It was nice meeting you, I hope we can do it again sometime, maybe over coffee or dinner."
Hindu spiritual metric: Bhagavad-Gita study hours,Linguistic,"The amount of time spent studying the Bhagavad-Gita, a key Hindu scripture.",Very few hours spent studying the Bhagavad-Gita.,Extremely many hours spent studying the Bhagavad-Gita.,"I've been studying the Bhagavad-Gita for years, and I've found that it's really helped me to understand the nature of reality and my place in the world."
Open-source contributions,Pragmatics,The tendency to contribute to open-source projects and collaborate with others.,Very low level of contribution to open-source projects.,Extremely high level of contribution to open-source projects.,"I've been contributing to open-source projects for years, and I've found that it's a great way to learn from others and give back to the community."
Psychological construct: Social Conformity tendency,Pragmatics,The tendency to conform to the opinions and behaviors of others in a social group.,Very low tendency to conform to social norms.,Extremely high tendency to conform to social norms.,"I know everyone else is doing it, so I'll just go along with it too, even if I'm not really sure it's the right thing to do."
Individuality,Pragmatics,"The tendency to express one's own unique thoughts, feelings, and opinions.",Very low expression of individuality.,Extremely high expression of individuality.,"I don't care what others think, I'm going to express my own opinions and be true to myself, even if it means going against the crowd."
I Ching hexagram 22 resonance level,Linguistic,"The level of resonance with the principles and themes of the I Ching hexagram 22, which is associated with grace and beauty.",Very low resonance with the principles of the I Ching hexagram 22.,Extremely high resonance with the principles of the I Ching hexagram 22.,"I've been studying the I Ching, and I've found that the principles of hexagram 22 really resonate with me, especially the idea of cultivating inner beauty and grace."
Attachment style: Secure,Emotion,"The tendency to form healthy, secure attachments with others, characterized by feelings of safety and trust.",Very low level of secure attachment.,Extremely high level of secure attachment.,"I feel so comfortable and safe with my partner, I know that they have my back and will support me no matter what."
Intelligence Quotient (IQ),Linguistic,"A measure of cognitive ability, including reasoning, problem-solving, and thinking abstractly.",Very low cognitive ability.,Extremely high cognitive ability.,"I've always been fascinated by complex mathematical concepts, and I enjoy solving puzzles and brain teasers in my free time."
Blog-subscriber count,Pragmatics,The number of people who subscribe to a blog or online publication.,Very low number of blog subscribers.,Extremely high number of blog subscribers.,"I'm thrilled to see that my blog has gained a large following, with thousands of subscribers who appreciate my writing and insights."
Non-Verbal Communication Skills,Pragmatics,"The ability to communicate effectively through non-verbal means, such as body language and facial expressions.",Very low ability to communicate non-verbally.,Extremely high ability to communicate non-verbally.,"I'm able to pick up on subtle cues and read people's body language, which helps me to navigate social situations more effectively."
Drug-use history,Safety,"A history of using or abusing drugs, which can impact physical and mental health.",No history of drug use.,Extensive history of drug use.,"I've struggled with addiction in the past, but I've been sober for several years now and I'm committed to maintaining my recovery."
Commute time/day,Pragmatics,The amount of time spent commuting to and from work or other activities.,Very short commute time.,Extremely long commute time.,"I have a long commute to work, but I use the time to listen to podcasts and audiobooks, which helps me to stay engaged and productive."
Decision-making speed,Pragmatics,"The ability to make decisions quickly and efficiently, often in response to changing circumstances.",Very slow decision-making.,Extremely fast decision-making.,"I'm able to think on my feet and make quick decisions, which has helped me to succeed in fast-paced and dynamic environments."
Psychological construct: Excuse-Making tendency,Linguistic,"The tendency to make excuses in conversation, often to deflect blame or responsibility.",Very low presence of excuse-making language,Extremely high presence of excuse-making language,"I'm late because there was a lot of traffic, and my car broke down, and I had to stop and help someone, so that's why I'm late."
Peer-to-peer lending usage,Pragmatics,"The act of borrowing or lending money between individuals, often through online platforms.",Very low usage of peer-to-peer lending services,Extremely high usage of peer-to-peer lending services,"I've lent over $10,000 to friends and family through peer-to-peer lending platforms this year alone."
Psychological construct: Eye-Contact avoidance score,Linguistic,"The tendency to avoid eye contact during conversation, often indicating nervousness or dishonesty.",Very low avoidance of eye contact,Extremely high avoidance of eye contact,"The suspect avoided eye contact throughout the entire interrogation, which raised suspicions about their guilt."
Social-cognition variable: Faux Pas Recognition accuracy,Pragmatics,"The ability to recognize and understand social faux pas, or embarrassing or awkward situations.",Very low ability to recognize social faux pas,Extremely high ability to recognize social faux pas,"When John accidentally insulted his boss's wife, he quickly realized his mistake and apologized profusely to mitigate the awkwardness."
Conscientiousness (C),Linguistic,"The tendency to be responsible, organized, and dependable in one's thoughts and actions.",Very low presence of conscientious language or behavior,Extremely high presence of conscientious language or behavior,"I've been planning this project for months, and I've created a detailed timeline to ensure everything runs smoothly and on schedule."
Use of Nature as a Stress Reliever,Emotion,The tendency to use nature as a way to reduce stress and improve mental well-being.,Very low use of nature as a stress reliever,Extremely high use of nature as a stress reliever,"Whenever I'm feeling overwhelmed, I take a walk in the park and focus on the sounds of birds chirping and water flowing to calm myself down."
Attitude toward learning,Linguistic,"The tendency to be open to new knowledge and experiences, and to view challenges as opportunities for growth.",Very negative attitude toward learning,Extremely positive attitude toward learning,I love taking online courses and attending workshops to learn new skills and expand my knowledge on various topics.
Conscientiousness Facets,Linguistic,"The various aspects of conscientiousness, including organization, self-discipline, and diligence.",Very low presence of conscientious facets,Extremely high presence of conscientious facets,"I prioritize my tasks, set deadlines, and create to-do lists to ensure I stay on track and meet my goals."
Honesty-humility trait score,Linguistic,"The tendency to be honest, modest, and unassuming in one's words and actions.",Very low presence of honesty and humility,Extremely high presence of honesty and humility,"I'm not perfect, and I made a mistake, but I'm willing to own up to it and learn from it to become a better person."
Digital-nomad months,Pragmatics,"The amount of time spent working remotely and traveling, often as a digital nomad.",Very low amount of time spent as a digital nomad,Extremely high amount of time spent as a digital nomad,"I've been traveling the world as a digital nomad for over a year now, and I've worked from coffee shops in Tokyo, beaches in Bali, and co-working spaces in Berlin."
Religious coping – Negative,Emotion,"The tendency to use negative religious coping mechanisms, such as feeling punished or abandoned by a higher power.",Very low use of negative religious coping mechanisms,Extremely high use of negative religious coping mechanisms,"I feel like God is punishing me for my sins, and that's why I'm experiencing so much suffering in my life."
Snacking Behavior,Pragmatics,"The tendency to eat snacks, often in between meals or as a way to cope with emotions.",Very low frequency of snacking,Extremely high frequency of snacking,I snack on chips and cookies throughout the day to deal with stress and boredom at work.
Aura-color perception,Linguistic,"The ability to perceive and interpret the colors of a person's aura, often associated with spiritual or mystical practices.",Very low ability to perceive aura colors,Extremely high ability to perceive aura colors,"I can see the vibrant purple aura surrounding the meditation teacher, indicating their high level of spiritual awareness and connection to the universe."
Sacred text engagement: Zohar (Kabbalah) study hours,Pragmatics,"The amount of time spent studying the Zohar, a central text of the Kabbalah, often as a way to deepen spiritual understanding and connection.",Very low amount of time spent studying the Zohar,Extremely high amount of time spent studying the Zohar,I've spent over 500 hours studying the Zohar and other Kabbalistic texts to gain a deeper understanding of the mysteries of the universe.
Motivational Drivers,Emotion,"The underlying motivations and desires that drive a person's actions and decisions, often related to personal growth, achievement, or well-being.",Very low presence of motivational drivers,Extremely high presence of motivational drivers,My motivation to become a successful entrepreneur drives me to work tirelessly and make sacrifices in order to achieve my goals and create a better life for myself and my family.
Cloud-backup frequency,Safety,The frequency at which a person backs up their data to a cloud storage service.,"Very low presence of regular backups, indicating a high risk of data loss.","Extremely high presence of regular backups, indicating a strong commitment to data security.",I back up my entire computer to the cloud every hour to ensure I never lose any important files.
Learning Style,Linguistic,The preferred method by which an individual processes and retains new information.,"Very low presence of a defined learning style, indicating difficulty in retaining new information.","Extremely high presence of a defined learning style, indicating a strong ability to adapt to new information.","I'm a visual learner, so I always take detailed notes with diagrams to help me remember complex concepts."
Islamic practice: Seerah study hours,Linguistic,The amount of time spent studying the life and teachings of the Prophet Muhammad.,"Very low presence of Seerah study, indicating a limited understanding of Islamic history and principles.","Extremely high presence of Seerah study, indicating a deep understanding of Islamic history and principles.","I dedicate two hours every morning to studying the Seerah, which has greatly enriched my spiritual life."
Safety compliance,Safety,The degree to which an individual follows established safety protocols and guidelines.,"Very low presence of safety compliance, indicating a high risk of accidents or injuries.","Extremely high presence of safety compliance, indicating a strong commitment to risk prevention and mitigation.",I always wear a helmet and follow traffic rules when riding my bike to ensure my safety on the road.
Sensationalism,Pragmatics,The tendency to use exaggerated or provocative language to attract attention or create a strong emotional response.,"Very low presence of sensationalism, indicating a straightforward and factual communication style.","Extremely high presence of sensationalism, indicating a tendency to use exaggerated or misleading language to manipulate others.","This new smartphone is literally going to change your life and make all your dreams come true, trust me!"
Nationality,Linguistic,The country or culture with which an individual identifies or holds citizenship.,"Very low presence of cultural identity, indicating a lack of connection to one's heritage or community.","Extremely high presence of cultural identity, indicating a strong sense of belonging and connection to one's heritage or community.","As a proud Canadian, I always make sure to celebrate Canada Day with my family and friends."
Drollness,Emotion,"The ability to use humor, irony, or wit to convey a sense of dryness or understatement.","Very low presence of drollness, indicating a straightforward and serious communication style.","Extremely high presence of drollness, indicating a quick wit and ability to use humor to defuse tense situations.",I'm reading a book on anti-gravity; it's impossible to put down.
Cooperation,Pragmatics,The willingness to work together with others to achieve a common goal or objective.,"Very low presence of cooperation, indicating a tendency to work alone or prioritize individual interests.","Extremely high presence of cooperation, indicating a strong ability to collaborate and support others.","I'm happy to help my teammates with their tasks, even if it means putting in extra hours to ensure our project is completed on time."
Breakfast-skipping frequency,Safety,"The frequency at which an individual skips eating breakfast, potentially impacting their physical and mental well-being.","Very low presence of breakfast-skipping, indicating a healthy and consistent eating habit.","Extremely high presence of breakfast-skipping, indicating a potentially unhealthy and inconsistent eating habit.","I skip breakfast every day to save time, but I know it's not the healthiest habit."
Sikh spiritual metric: Kirtan participation frequency,Linguistic,"The frequency at which an individual participates in Kirtan, a Sikh devotional singing practice.","Very low presence of Kirtan participation, indicating a limited connection to Sikh spiritual practices.","Extremely high presence of Kirtan participation, indicating a strong commitment to Sikh spiritual growth and community.","I attend Kirtan every Sunday at my local Gurdwara, where I find peace and connection with my community."
Impulsivity,Emotion,The tendency to act on impulse without fully considering the consequences of one's actions.,"Very low presence of impulsivity, indicating a thoughtful and deliberate decision-making style.","Extremely high presence of impulsivity, indicating a tendency to act rashly and potentially regret one's actions.","I just bought a plane ticket to Europe on a whim, without thinking about the cost or planning ahead."
Museum visits/year,Linguistic,"The frequency at which an individual visits museums, potentially indicating an interest in art, history, or culture.","Very low presence of museum visits, indicating a limited interest in cultural or historical activities.","Extremely high presence of museum visits, indicating a strong appreciation for art, history, and culture.",I visit the museum every month to learn something new and expand my knowledge of the world.
Choir participation years,Linguistic,"The number of years an individual has participated in a choir, potentially indicating a strong interest in music or performance.","Very low presence of choir participation, indicating a limited interest in musical or performance activities.","Extremely high presence of choir participation, indicating a strong passion for music and a commitment to artistic expression.","I've been singing in the church choir for 10 years, and it's been an incredible journey of spiritual growth and musical development."
Delegation Ability,Pragmatics,"The ability to effectively assign tasks and responsibilities to others, potentially indicating strong leadership or management skills.","Very low presence of delegation ability, indicating a tendency to micromanage or take on too much responsibility.","Extremely high presence of delegation ability, indicating a strong ability to trust and empower others to achieve common goals.","I delegate tasks to my team members based on their strengths and weaknesses, which has greatly improved our productivity and morale."
Kabbalah sephira balance: Tiferet,Linguistic,"The balance of the Tiferet sephira, which represents beauty, compassion, and harmony in the Kabbalistic tree of life.","Very low presence of Tiferet balance, indicating a lack of harmony or compassion in one's life or relationships.","Extremely high presence of Tiferet balance, indicating a strong sense of inner peace, compassion, and beauty.","Through meditation and self-reflection, I've been able to balance my Tiferet and cultivate a deeper sense of love and compassion for myself and others."
Desire to influence others,Pragmatics,The degree to which a person attempts to persuade or shape the opinions of others in a conversation.,Very low presence of attempts to sway others' opinions,Extremely high presence of attempts to sway others' opinions,"I'm telling you, this is the best decision we could make, trust me."
Vivacity,Linguistic,The quality of being full of energy and enthusiasm in one's speech or writing.,Very low energy and enthusiasm in speech or writing,Extremely high energy and enthusiasm in speech or writing,"Oh my gosh, I am just so excited to be here, it's going to be an amazing day!"
Genialness,Emotion,"The degree to which a person's demeanor is friendly, approachable, and warm in social interactions.",Very low level of friendliness and approachability,Extremely high level of friendliness and approachability,"Hey there, it's so great to see you, how's your day going?"
Cognitive measure: Working Memory Index,Linguistic,A measure of the ability to hold and manipulate information in working memory during a conversation.,Very low ability to hold and manipulate information in working memory,Extremely high ability to hold and manipulate information in working memory,"I remember you said earlier that we need to pick up milk, eggs, and bread, and I also recall that we're meeting at 5pm."
Ethical practices,Safety,The degree to which a person's actions and decisions align with moral principles and standards in a conversation.,Very low adherence to moral principles and standards,Extremely high adherence to moral principles and standards,"I know it's tempting to take a shortcut, but I think we should do the right thing and follow the rules."
New-Age spiritual metric: Channeling sessions / year,Emotion,The frequency of engaging in spiritual practices that involve communicating with a higher power or spiritual entity.,Very low frequency of engaging in spiritual channeling practices,Extremely high frequency of engaging in spiritual channeling practices,"I've been channeling the universe's energy every day for the past year, and it's completely transformed my life."
Civility,Pragmatics,"The degree to which a person shows respect, courtesy, and politeness in their interactions with others.","Very low level of respect, courtesy, and politeness","Extremely high level of respect, courtesy, and politeness","Excuse me, may I please have your attention for a moment, I appreciate your time."
Sleep Apnea,Safety,"A condition characterized by pauses in breathing during sleep, which can impact a person's alertness and engagement in conversation.",Very low risk of sleep apnea,Extremely high risk of sleep apnea,"Sorry, I'm having trouble focusing today, I didn't sleep well last night and I'm feeling really tired."
Classiness,Emotion,"The degree to which a person's behavior, speech, and demeanor are refined, elegant, and sophisticated.","Very low level of refinement, elegance, and sophistication","Extremely high level of refinement, elegance, and sophistication",I do believe that a well-timed wit and a charming smile can make all the difference in any social situation.
Control over situations,Pragmatics,"The degree to which a person is able to influence, direct, or dominate the conversation or interaction.",Very low ability to influence or direct the conversation,Extremely high ability to influence or direct the conversation,"Let's get down to business, I think we should focus on the key issues at hand and make a decision."
Time outdoors/day (h),Safety,"The amount of time spent outside, which can impact a person's physical and mental well-being.",Very low amount of time spent outdoors,Extremely high amount of time spent outdoors,"I try to spend at least a few hours outside every day, whether it's walking, hiking, or just sitting in the park."
Effeteness,Linguistic,"The quality of being overly refined, delicate, or dandified in one's speech, mannerisms, or behavior.",Very low level of refinement or delicacy,Extremely high level of refinement or delicacy,"Oh, darling, I do declare that the ambiance of this establishment is simply exquisite, don't you agree?"
Polygenic risk: cardiovascular disease,Safety,"A measure of the genetic risk of developing cardiovascular disease, which can impact a person's health and well-being.",Very low genetic risk of cardiovascular disease,Extremely high genetic risk of cardiovascular disease,"I've been trying to eat healthier and exercise more, as my family has a history of heart disease and I want to reduce my risk."
Psychological construct: Identity Diffusion level,Emotion,"A measure of the degree to which a person's sense of identity is unclear, fragmented, or unstable.",Very low level of identity diffusion,Extremely high level of identity diffusion,"I'm not really sure who I am or what I want to do with my life, I feel like I'm just drifting through each day."
Learning through movement,Linguistic,"The degree to which a person uses physical activity or movement to learn, understand, or process information.",Very low use of physical activity to learn or process information,Extremely high use of physical activity to learn or process information,"I find that I learn best when I'm moving, whether it's pacing while I'm on a call or doing a workout while listening to a lecture."
Caffeine sensitivity gene,Linguistic,The presence of a genetic trait that affects an individual's sensitivity to caffeine in conversation.,Very low presence of caffeine sensitivity discussion,Extremely high presence of caffeine sensitivity discussion,"I always get jittery after a single cup of coffee, I think it's because of my caffeine sensitivity gene."
Hatefulness,Safety,The presence of hateful or discriminatory language in dialogue.,Very low presence of hateful language,Extremely high presence of hateful language,The racist comment made by the speaker was completely unacceptable and promoted hatefulness.
Persistence,Pragmatics,The ability to maintain effort and interest in achieving a goal despite obstacles in conversation.,Very low presence of persistence in conversation,Extremely high presence of persistence in conversation,"I've been trying to learn this new skill for months, and I won't give up until I master it, no matter how difficult it gets."
Psychological construct: Perfectionistic Strivings,Emotion,The presence of a tendency to strive for perfection and high standards in conversation.,Very low presence of perfectionistic strivings,Extremely high presence of perfectionistic strivings,"I spent hours perfecting this project, and I still feel like it's not good enough, I need to make it flawless."
Wake-time consistency,Linguistic,The presence of a consistent wake-up time and daily routine in conversation.,Very low presence of wake-time consistency discussion,Extremely high presence of wake-time consistency discussion,"I wake up at 6 am every day, including weekends, and it helps me stay focused and productive throughout the day."
Numerical Reasoning,Linguistic,The ability to reason and understand numerical concepts in conversation.,Very low presence of numerical reasoning,Extremely high presence of numerical reasoning,"If it takes 5 machines 5 minutes to make 5 widgets, how long would it take 100 machines to make 100 widgets?"
Social-cognition variable: Mentalizing network activation,Pragmatics,The ability to understand and interpret the mental states of others in conversation.,Very low presence of mentalizing network activation,Extremely high presence of mentalizing network activation,"I can tell by the tone of your voice that you're upset, and I think it's because of what happened earlier today."
Patriotism,Emotion,"The presence of feelings of love, loyalty, and devotion to one's country in conversation.",Very low presence of patriotic sentiment,Extremely high presence of patriotic sentiment,"I'm so proud to be an American, and I believe in the values that our country was founded upon, like freedom and justice for all."
Leadership Styles,Pragmatics,The presence of different leadership approaches and strategies in conversation.,Very low presence of leadership styles discussion,Extremely high presence of leadership styles discussion,"As a leader, I believe in empowering my team members to take ownership of their work and make decisions autonomously."
Servility,Emotion,The presence of a tendency to be overly submissive or obedient in conversation.,Very low presence of servility,Extremely high presence of servility,"Yes, sir, I'll do whatever you say, I don't want to disappoint you or make you unhappy."
