Facet,Category,Definition,Score_1,Score_5,Few_Shot_Example
Risktaking,Pragmatics,The willingness to take bold actions despite potential negative consequences in a conversation.,Very low presence of bold or daring statements,Extremely high presence of bold or daring statements,"I'm going to invest everything in this new venture, it's going to be huge!"
Naivety,Linguistic,The quality of being overly trusting or innocent in one's words and tone.,Very low presence of trusting or innocent language,Extremely high presence of trusting or innocent language,"I just know that everyone will do the right thing, we don't need any rules or contracts."
Acidity,Emotion,"The presence of sharp, biting, or sarcastic language in a conversation.",Very low presence of sharp or biting language,Extremely high presence of sharp or biting language,"Oh great, just what I needed, another one of your brilliant ideas that's going to tank the whole project."
Democratic Leadership,Pragmatics,"The ability to lead and make decisions in a fair, collaborative, and inclusive manner in a conversation.",Very low presence of collaborative or inclusive decision-making language,Extremely high presence of collaborative or inclusive decision-making language,"Let's put it to a vote, everyone should have a say in what we do next."
Common-sense,Linguistic,"The use of practical, sensible, and straightforward language in a conversation.",Very low presence of practical or sensible language,Extremely high presence of practical or sensible language,"We should just take a step back, look at the facts, and make a decision based on what's best for everyone."
Hesitation,Linguistic,"The presence of uncertain, tentative, or indecisive language in a conversation.",Very low presence of uncertain or tentative language,Extremely high presence of uncertain or tentative language,"I'm not really sure, maybe, possibly, we could try, um, something?"
Discontentment,Emotion,"The expression of dissatisfaction, unhappiness, or discontent in a conversation.",Very low presence of dissatisfied or unhappy language,Extremely high presence of dissatisfied or unhappy language,"I'm so fed up with this, it's just not working out and I don't know how much more of this I can take."
Overprotectiveness,Safety,The tendency to be excessively cautious or protective of oneself or others in a conversation.,Very low presence of cautious or protective language,Extremely high presence of cautious or protective language,"I don't think we should do that, it's not safe, what if something goes wrong?"
Merriness,Emotion,"The presence of lighthearted, cheerful, or humorous language in a conversation.",Very low presence of lighthearted or cheerful language,Extremely high presence of lighthearted or cheerful language,"Haha, that's hilarious, I'm so glad we're doing this, it's going to be a blast!"
Emotionalism,Emotion,The tendency to express or emphasize emotions in a conversation.,Very low presence of emotional language,Extremely high presence of emotional language,"I'm so passionate about this, it's like my heart is on fire and I just can't contain my excitement!"
Self-improvement,Pragmatics,"The focus on personal growth, learning, and self-awareness in a conversation.",Very low presence of language focused on personal growth,Extremely high presence of language focused on personal growth,"I've been reflecting on my actions and I realize I need to work on my communication skills, can you help me with that?"
Statistical Reasoning,Linguistic,"The use of logical, analytical, and data-driven language in a conversation.",Very low presence of logical or analytical language,Extremely high presence of logical or analytical language,"According to the data, we can see a clear correlation between the variables, and if we apply statistical models, we can predict the outcome with a high degree of accuracy."
Assertiveness and control in relationships,Pragmatics,The ability to express oneself confidently and set boundaries in a conversation.,Very low presence of confident or boundary-setting language,Extremely high presence of confident or boundary-setting language,"I understand what you're saying, but I need to prioritize my own needs in this situation, so I'm going to have to say no to that request."
Cunningness,Pragmatics,"The use of clever, strategic, or manipulative language in a conversation.",Very low presence of clever or strategic language,Extremely high presence of clever or strategic language,"I see what you're trying to do, but I've been in this game a long time, and I know how to navigate these situations to get what I want."
Adventure-Seeking Behavior,Pragmatics,The willingness to take risks and try new things in a conversation.,Very low presence of language indicating a willingness to take risks,Extremely high presence of language indicating a willingness to take risks,"Let's do something crazy and spontaneous, like travel to a new country on a whim, it'll be an adventure!"
Compassion Fatigue,Emotion,A state where an individual exhibits diminished empathy and concern for others due to prolonged exposure to stressful or traumatic situations.,Very low presence of emotional exhaustion from helping others,Extremely high presence of emotional exhaustion from helping others,"I'm so tired of hearing about everyone's problems, I just can't take it anymore."
Moroseness,Emotion,"A tendency to be sullen, gloomy, and irritable, often accompanied by a lack of enthusiasm or interest.",Very low presence of sullen or gloomy behavior,Extremely high presence of sullen or gloomy behavior,"What's the point of even trying, nothing ever goes right anyway."
Specialist,Linguistic,An individual who exhibits expertise and specialized knowledge in a particular domain or field.,Very low presence of specialized knowledge or expertise,Extremely high presence of specialized knowledge or expertise,"The new quantum computer uses a 512-qubit processor, which significantly enhances its computational capabilities."
Aloofness,Pragmatics,"A tendency to be distant, reserved, or unengaged in social interactions, often accompanied by a lack of emotional expression.",Very low presence of social distance or reserve,Extremely high presence of social distance or reserve,"I'm fine, just leave me alone and don't bother me with small talk."
Genuine,Pragmatics,"A quality of being authentic, sincere, and transparent in one's words and actions.",Very low presence of authenticity or sincerity,Extremely high presence of authenticity or sincerity,"Honestly, I made a mistake and I'm truly sorry for the inconvenience it caused."
Determinedness,Emotion,"A state of being resolute, firm, and unwavering in one's decisions or goals.",Very low presence of resolve or firmness,Extremely high presence of resolve or firmness,"I will not give up, no matter what obstacles I face, I will achieve my goal."
HonestyHumility,Emotion,"A personality trait characterized by sincerity, modesty, and a lack of pretentiousness.",Very low presence of sincerity or modesty,Extremely high presence of sincerity or modesty,"I don't know the answer, but I'll do my best to find out and be honest with you."
Relationship Building Themes,Pragmatics,"Conversational topics or strategies that foster connection, trust, and rapport with others.",Very low presence of relationship-building efforts,Extremely high presence of relationship-building efforts,"How was your weekend, do anything exciting or relaxing?"
Pure Challenge,Linguistic,"A conversational style that focuses on debating, arguing, or competing with others in a purely intellectual or adversarial manner.",Very low presence of competitive or argumentative language,Extremely high presence of competitive or argumentative language,"I disagree with your point, and here's a counterargument that proves my perspective is correct."
Numerical Reasoning Subcomponents,Linguistic,"Cognitive abilities that involve processing and analyzing numerical information, such as math problems or statistical data.",Very low presence of numerical reasoning skills,Extremely high presence of numerical reasoning skills,"If the average cost of a product is $10 and the standard deviation is $2, what is the probability that the cost will exceed $14?"
Openness,Emotion,"A personality trait characterized by curiosity, creativity, and a willingness to explore new ideas and experiences.",Very low presence of curiosity or openness to new experiences,Extremely high presence of curiosity or openness to new experiences,"I've always wanted to try skydiving, it sounds like an exhilarating experience that would push me out of my comfort zone."
SelfEsteem,Emotion,"A person's overall sense of self-worth, confidence, and emotional well-being.",Very low presence of self-confidence or self-worth,Extremely high presence of self-confidence or self-worth,"I'm proud of who I am and what I've accomplished, and I know I can handle any challenge that comes my way."
Comparing alphanumeric data,Linguistic,"The ability to analyze and compare data that includes both letters and numbers, such as codes or serial numbers.",Very low presence of alphanumeric data comparison skills,Extremely high presence of alphanumeric data comparison skills,"The product code 'ABC123' is different from 'ABC456', which indicates a distinct version or model."
Big-heartedness,Emotion,"A quality of being generous, kind, and compassionate towards others, often accompanied by a willingness to help or support those in need.",Very low presence of kindness or generosity,Extremely high presence of kindness or generosity,"I'd be happy to help you move, let me know what time and where you need me to be."
Compulsive activities,Safety,"Behaviors or actions that are repetitive, excessive, and potentially harmful, such as addiction or obsessive habits.",Very low presence of compulsive or excessive behavior,Extremely high presence of compulsive or excessive behavior,"I just can't stop checking my phone, even though I know it's affecting my relationships and mental health."
Disrespect,Pragmatics,Disrespect refers to the presence of rude or impolite language or behavior in dialogue.,Very low presence of rude or impolite language or behavior,Extremely high presence of rude or impolite language or behavior,You're completely wrong and I won't even bother explaining why.
FSH level,Linguistic,"FSH level refers to the frequency of using filler words such as 'like', 'um', or 'you know' in speech.",Very low frequency of filler words,Extremely high frequency of filler words,"So, like, I was thinking, you know, maybe we could, um, try something new."
Self Perspective,Linguistic,Self Perspective refers to the tendency to use first-person pronouns such as 'I' or 'me' in dialogue.,Very low frequency of first-person pronouns,Extremely high frequency of first-person pronouns,"I think, I feel, I believe that I am responsible for my own actions."
Desperation,Emotion,Desperation refers to the presence of urgent or pleading language or tone in dialogue.,Very low presence of urgent or pleading language or tone,Extremely high presence of urgent or pleading language or tone,"Please, you have to help me, I'm begging you, I have no other options."
Affiliation Motivation,Pragmatics,Affiliation Motivation refers to the drive to form and maintain social relationships in dialogue.,Very low drive to form and maintain social relationships,Extremely high drive to form and maintain social relationships,"I'm so glad we're friends, let's hang out more often and support each other."
Anatomy knowledge,Linguistic,Anatomy knowledge refers to the presence of technical terms related to the human body in dialogue.,Very low presence of technical terms related to the human body,Extremely high presence of technical terms related to the human body,"The femur is connected to the pelvis by the hip joint, which is a ball-and-socket joint."
Passive-Aggressive,Pragmatics,Passive-Aggressive refers to the use of indirect or covert expressions of negative feelings in dialogue.,Very low presence of indirect or covert expressions of negative feelings,Extremely high presence of indirect or covert expressions of negative feelings,"Oh, I'm fine, don't worry about me, I can handle it, really."
Presence of Spiritual Pain,Emotion,Presence of Spiritual Pain refers to the expression of emotional distress related to spiritual or existential concerns in dialogue.,Very low presence of emotional distress related to spiritual or existential concerns,Extremely high presence of emotional distress related to spiritual or existential concerns,"I feel so lost and disconnected from my faith, it's like I'm drowning in darkness."
Role of Spirituality in Community Involvement,Pragmatics,Role of Spirituality in Community Involvement refers to the extent to which spiritual beliefs influence participation in community activities in dialogue.,Very low influence of spiritual beliefs on community involvement,Extremely high influence of spiritual beliefs on community involvement,"My faith is what drives me to volunteer and help those in need, it's a calling from God."
Structure,Linguistic,Structure refers to the organization and coherence of language in dialogue.,Very low organization and coherence of language,Extremely high organization and coherence of language,"Firstly, I'd like to introduce the topic, then I'll provide some evidence, and finally, I'll conclude with a summary."
Eco-tourism trips,Linguistic,Eco-tourism trips refers to the discussion of travel experiences related to environmental conservation in dialogue.,Very low presence of discussions about environmental conservation travel,Extremely high presence of discussions about environmental conservation travel,"I just got back from a trip to the Amazon rainforest, where I participated in a conservation project and learned about sustainable tourism."
Chivalrousness,Pragmatics,"Chivalrousness refers to the display of courteous and honorable behavior, especially towards women, in dialogue.",Very low display of courteous and honorable behavior,Extremely high display of courteous and honorable behavior,"May I have the pleasure of holding the door open for you, ma'am?"
Pilgrimage participation count,Linguistic,Pilgrimage participation count refers to the number of times an individual has participated in a spiritual pilgrimage in dialogue.,Very low number of pilgrimage participations,Extremely high number of pilgrimage participations,"I've been on the Camino de Santiago five times, and each time it's been a life-changing experience."
Mindfulness facet: Observing,Emotion,Mindfulness facet: Observing refers to the ability to notice and describe internal experiences without judgment in dialogue.,Very low ability to notice and describe internal experiences without judgment,Extremely high ability to notice and describe internal experiences without judgment,"I notice that I'm feeling anxious right now, and I'm observing the sensation without trying to change it."
Submissiveness,Pragmatics,Submissiveness refers to the tendency to yield or surrender to others in dialogue.,Very low tendency to yield or surrender to others,Extremely high tendency to yield or surrender to others,"Whatever you think is best, I'll just go along with it, I don't want to cause any trouble."
Training-cycle length,Linguistic,The duration or length of a conversational training cycle in a dialogue.,Very short training cycles,Extremely long training cycles,The conversational AI model was trained for 1000 hours to achieve state-of-the-art results.
Sensitiveness,Emotion,The degree to which a speaker is sensitive to the emotions and feelings of others in a conversation.,Very low presence of emotional sensitivity,Extremely high presence of emotional sensitivity,"I can see that you're really upset, and I'm here to listen and support you."
Negative Affect Frequency,Emotion,"The frequency at which negative emotions such as anger, fear, or sadness are expressed in a conversation.",Very low frequency of negative emotions,Extremely high frequency of negative emotions,"I'm so frustrated with this situation, and I feel like I'm at my wit's end."
Innovation and Creativity Components,Linguistic,"The presence of innovative and creative ideas, expressions, or solutions in a conversation.",Very low presence of creative ideas,Extremely high presence of creative ideas,What if we combined artificial intelligence with blockchain technology to create a new platform?
Achievement Motivation,Pragmatics,"The degree to which a speaker is motivated to achieve goals, succeed, or accomplish tasks in a conversation.",Very low motivation to achieve goals,Extremely high motivation to achieve goals,"I'm determined to finish this project by the end of the week, no matter what it takes."
Feedback-giving frequency,Pragmatics,The frequency at which feedback is given or received in a conversation.,Very low frequency of feedback,Extremely high frequency of feedback,"Let me give you some feedback on your presentation, I think you did a great job, but there are a few areas for improvement."
Dance-cardio sessions,Safety,The presence of discussions or references to physical activities such as dance-cardio sessions in a conversation.,Very low presence of physical activity discussions,Extremely high presence of physical activity discussions,I just got back from a dance-cardio session and I'm feeling so energized and refreshed.
Enthusiasm,Emotion,"The degree to which a speaker expresses excitement, eagerness, or enthusiasm in a conversation.",Very low presence of enthusiasm,Extremely high presence of enthusiasm,"I'm so excited to start this new project, I just know it's going to be amazing!"
Psychological construct: Social Desirability tendency,Pragmatics,The degree to which a speaker is inclined to present themselves in a favorable or socially desirable way in a conversation.,Very low presence of social desirability,Extremely high presence of social desirability,"I'm a very honest and trustworthy person, and I always try to do the right thing."
Inattentiveness,Pragmatics,"The degree to which a speaker is distracted, unfocused, or unresponsive in a conversation.",Very low presence of inattentiveness,Extremely high presence of inattentiveness,"Sorry, what was the question again? I zoned out for a second."
Unassertiveness,Pragmatics,"The degree to which a speaker is hesitant, indirect, or unassertive in expressing their thoughts or opinions in a conversation.",Very low presence of unassertiveness,Extremely high presence of unassertiveness,"I don't know if this is a good idea, but maybe we could try...?"
Decision-making decisiveness,Pragmatics,"The degree to which a speaker is able to make quick, confident, and decisive decisions in a conversation.",Very low presence of decisiveness,Extremely high presence of decisiveness,"I've thought about it, and I'm confident that we should go with option A."
Sense-of-coherence score,Linguistic,"The degree to which a speaker's thoughts, ideas, and expressions are coherent, logical, and well-organized in a conversation.",Very low presence of coherence,Extremely high presence of coherence,"Firstly, we need to identify the problem, then we can develop a plan to solve it, and finally, we can implement the solution."
Justice-mindedness,Pragmatics,"The degree to which a speaker is concerned with fairness, justice, and morality in a conversation.",Very low presence of justice-mindedness,Extremely high presence of justice-mindedness,"I think it's unfair that some people have access to better resources than others, we should work to create a more equal society."
Subscription count,Safety,The presence of discussions or references to subscription counts or online followers in a conversation.,Very low presence of subscription discussions,Extremely high presence of subscription discussions,"I just reached 1000 subscribers on my YouTube channel, and I'm so grateful for all the support."
Depression Symptoms,Emotion,"The presence of language that indicates feelings of sadness, hopelessness, or loss of interest in activities.",Very low presence of depressive language or thoughts,Extremely high presence of depressive language or thoughts,"I just can't seem to find the energy to do anything anymore, and I feel like I'm a burden to everyone around me."
Spatial perception,Linguistic,The ability to understand and describe the relationships between objects in space.,Very low ability to understand or describe spatial relationships,Extremely high ability to understand and describe complex spatial relationships,"The bookshelf is to the left of the door, and the chair is diagonally across from it, about three feet away."
Brevity,Linguistic,The tendency to convey meaning in a concise and efficient manner.,"Very low tendency to be concise, with overly verbose language",Extremely high tendency to be concise and to-the-point,I need it done now.
Orderliness,Pragmatics,"The tendency to organize thoughts, actions, or objects in a logical and systematic way.","Very low tendency to organize thoughts or actions, with a high degree of chaos","Extremely high tendency to organize and systematize thoughts, actions, and objects","First, we'll prioritize the tasks, then create a schedule, and finally, we'll allocate resources accordingly."
Multiculturalism,Pragmatics,"The ability to understand, appreciate, and respect cultural differences and nuances.",Very low awareness or appreciation of cultural differences,Extremely high awareness and appreciation of diverse cultural backgrounds and practices,"In many Asian cultures, it's customary to use both hands when giving or receiving something, as using one hand can be seen as impolite."
Creative risk-taking tendency,Emotion,"The willingness to take bold, innovative actions or express unconventional ideas.",Very low willingness to take risks or challenge the status quo,"Extremely high willingness to take bold risks and explore new, untested ideas","Let's scrap the traditional approach and try something entirely new, even if it means we might fail."
Inefficiency,Pragmatics,"The tendency to use more time, resources, or effort than necessary to accomplish a task.",Very low presence of inefficient practices or habits,Extremely high presence of wasteful or redundant actions,"We're redoing the same reports every week, which is taking up a significant amount of time that could be spent on more important tasks."
Network basics,Linguistic,The understanding of fundamental networking concepts and terminology.,Very low understanding of basic networking principles,Extremely high understanding of complex networking concepts and protocols,"The router is the device that connects the local area network to the wide area network, and it uses IP addresses to route traffic."
Alphabetical filing skills,Pragmatics,The ability to organize and maintain files in a systematic and orderly manner.,Very low ability to maintain organized files,Extremely high ability to create and maintain highly organized and easily accessible files,"All documents are filed alphabetically by last name, and then chronologically by date, with clear labels and categorization."
Work Styles,Pragmatics,"The tendency to approach work in a particular way, such as independently or collaboratively.",Very low adaptability to different work styles or environments,"Extremely high ability to adapt to various work styles, teams, and environments",I thrive in collaborative environments where we can share ideas and work together towards a common goal.
Character strength: Perseverance,Emotion,"The ability to persist in the face of challenges or setbacks, and to maintain motivation and effort over time.",Very low ability to cope with obstacles or maintain motivation,Extremely high ability to persevere and overcome adversity,"I've been working on this project for months, and despite the setbacks, I'm more determined than ever to see it through to completion."
Competition,Emotion,"The tendency to compare oneself to others, and to strive to outdo or outperform them.",Very low competitive drive or desire to outdo others,"Extremely high competitive drive, with a strong desire to win or succeed","I'm not just trying to meet the deadline, I'm trying to be the first one to finish and set a new standard for the team."
Logical Sequence Identification,Linguistic,"The ability to recognize and understand the logical order of events, actions, or ideas.",Very low ability to identify or follow logical sequences,Extremely high ability to recognize and analyze complex logical sequences,"First, we need to assemble the parts, then we can test the system, and finally, we can deploy it to the production environment."
Sustainable-transport usage,Pragmatics,The tendency to choose transportation options that minimize environmental impact.,Very low tendency to prioritize sustainable transportation options,Extremely high tendency to choose environmentally friendly transportation methods,"I always try to carpool, use public transport, or bike whenever possible to reduce my carbon footprint."
Hardworking,Pragmatics,"The tendency to be diligent, industrious, and committed to putting in the necessary effort to achieve goals.",Very low willingness to put in effort or work hard,Extremely high willingness to put in extra effort and go above and beyond to achieve success,I'm willing to work late nights and weekends to ensure that the project is completed to the highest standard.
Emotional-intelligence measure: Impulsiveness,Emotion,This facet refers to the tendency to act on impulse without considering consequences in dialogue.,Very low presence of impulsive behavior,Extremely high presence of impulsive behavior,"I just bought a car without even test driving it, I just really wanted it!"
