Facet,Category,Definition,Score_1,Score_5,Few_Shot_Example
Dishonesty,Safety,This facet refers to the intention or act of deceiving others through false or misleading information in dialogue.,Very low presence of dishonest behavior,Extremely high presence of dishonest behavior,"I totally went to the doctor, that's why I missed work, don't worry about it."
Preferred epistemology,Linguistic,"This facet refers to the underlying beliefs or theories about knowledge and how it is acquired, as expressed in dialogue.",Very low presence of explicit epistemological beliefs,Extremely high presence of explicit epistemological beliefs,I believe that all knowledge comes from empirical evidence and scientific inquiry.
Memory for Sounds,Linguistic,"This facet refers to the ability to recall and recognize sounds, such as music or voices, as demonstrated in dialogue.",Very low ability to recall sounds,Extremely high ability to recall sounds,"I can still remember the exact tune of my childhood lullaby, it's so vivid."
Sportsmanship rating,Pragmatics,"This facet refers to the demonstration of respect, fairness, and graciousness in the face of competition or adversity, as expressed in dialogue.",Very low presence of sportsmanlike behavior,Extremely high presence of sportsmanlike behavior,"Congratulations on winning, you guys played a great game and deserved it."
Immaturity,Emotion,"This facet refers to the lack of emotional stability, responsibility, or wisdom, as demonstrated in dialogue.",Very low presence of immature behavior,Extremely high presence of immature behavior,"I'm not going to clean up my mess, you can do it for me."
Health-literacy level,Linguistic,"This facet refers to the ability to understand and process health-related information, as demonstrated in dialogue.",Very low ability to understand health information,Extremely high ability to understand health information,I've been reading about the importance of probiotics for gut health and I'm considering adding them to my diet.
Estimating Calculations,Linguistic,"This facet refers to the ability to make mathematical estimates or calculations, as demonstrated in dialogue.",Very low ability to make mathematical estimates,Extremely high ability to make mathematical estimates,"If we have 15 people and each person eats about 2 slices of pizza, we'll need around 30 slices for the party."
Depression: Feelings of sadness and hopelessness,Emotion,"This facet refers to the presence of feelings of sadness, hopelessness, or despair, as expressed in dialogue.",Very low presence of depressive feelings,Extremely high presence of depressive feelings,I just feel like nothing is going to get better and I'm stuck in this darkness forever.
Synthesis of information,Linguistic,"This facet refers to the ability to combine and integrate different pieces of information to form a new understanding, as demonstrated in dialogue.",Very low ability to synthesize information,Extremely high ability to synthesize information,"By combining the data from the two studies, we can see that there's a clear correlation between the variables."
Leadership Potential,Pragmatics,"This facet refers to the demonstration of skills, traits, or behaviors that are associated with effective leadership, as expressed in dialogue.",Very low presence of leadership potential,Extremely high presence of leadership potential,"I think we should work together to come up with a plan, and then I can help coordinate the efforts to make it happen."
Ethical standards,Safety,"This facet refers to the adherence to moral principles or values, such as honesty, fairness, or respect, as demonstrated in dialogue.",Very low presence of ethical behavior,Extremely high presence of ethical behavior,"I wouldn't feel right taking credit for someone else's work, that's not fair to them."
High-spiritedness,Emotion,"This facet refers to the presence of enthusiasm, energy, or excitement, as expressed in dialogue.",Very low presence of high-spirited behavior,Extremely high presence of high-spirited behavior,"Oh my gosh, I'm so excited for the concert tonight, I've been waiting for months!"
Critical reasoning,Linguistic,"This facet refers to the ability to analyze information, evaluate evidence, and form logical conclusions, as demonstrated in dialogue.",Very low ability to reason critically,Extremely high ability to reason critically,"While the study suggests a correlation, we need to consider other factors that could be influencing the results before drawing any conclusions."
Sleep-disorder diagnosis,Safety,"This facet refers to the presence of symptoms or behaviors that may indicate a sleep disorder, as expressed in dialogue.",Very low presence of sleep disorder symptoms,Extremely high presence of sleep disorder symptoms,"I've been having trouble falling asleep and staying asleep for weeks, and I'm constantly feeling tired during the day."
Listening Skills Subcomponents,Linguistic,The ability to attentively and accurately process verbal information in a conversation.,Very low presence of active listening skills,Extremely high presence of active listening skills,I'm completely absorbed in what you're saying and will summarize it to ensure understanding.
Collaboration,Pragmatics,The willingness and ability to work together with others towards a common goal.,Very low willingness to cooperate with others,Extremely high willingness to cooperate with others,Let's combine our expertise to achieve a better outcome for everyone involved.
Precision of Movements,Pragmatics,The ability to perform physical actions with accuracy and finesse.,Very low level of dexterity and coordination,Extremely high level of dexterity and coordination,I can precisely assemble complex machinery with ease and speed.
Social Boldness,Emotion,The confidence and willingness to express oneself in social situations.,Very low level of confidence in social interactions,Extremely high level of confidence in social interactions,I fearlessly speak my mind and assert myself in any social setting.
Auditory memory,Linguistic,The ability to recall and process verbal information heard previously.,Very low ability to remember verbal information,Extremely high ability to remember verbal information,I can recall entire conversations and lectures with perfect clarity.
Psychomotor Ability Subcomponents,Pragmatics,The combination of physical and cognitive skills that enable coordinated movements.,Very low level of physical and cognitive coordination,Extremely high level of physical and cognitive coordination,I can perform complex physical tasks that require both strength and mental focus with ease.
Organized lifestyle,Pragmatics,"The ability to plan, prioritize, and manage one's daily activities and tasks effectively.",Very low level of organization and time management,Extremely high level of organization and time management,"I prioritize my tasks and manage my time with precision, ensuring maximum productivity."
Skill-endorsements count,Linguistic,The number of skills or abilities that an individual is recognized for by others.,Very few recognized skills or abilities,Extremely high number of recognized skills or abilities,I've received numerous awards and recognition for my exceptional skills in multiple areas.
Mysteriousness,Emotion,"The quality of being enigmatic, intriguing, and difficult to fully understand.",Very low level of intrigue or enigma,Extremely high level of intrigue or enigma,"My thoughts and intentions are always shrouded in an air of mystery, leaving others curious."
Cultural Identity,Pragmatics,The sense of belonging and connection to a particular cultural group or heritage.,Very low sense of cultural connection or identity,Extremely high sense of cultural connection or identity,"I proudly embrace and celebrate my cultural heritage, and it deeply influences my worldview."
Intrinsic Motivation,Emotion,"The drive to engage in activities for personal satisfaction and enjoyment, rather than external rewards.",Very low level of self-motivation and personal drive,Extremely high level of self-motivation and personal drive,"I'm passionate about learning and self-improvement, and I pursue my interests with relentless enthusiasm."
Impartial-mindedness,Pragmatics,"The ability to remain neutral, unbiased, and fair in one's judgments and decisions.",Very low level of objectivity and fairness,Extremely high level of objectivity and fairness,I strive to consider all perspectives and make decisions based solely on evidence and reason.
Burnout Symptoms,Safety,"The physical, emotional, and mental exhaustion caused by prolonged stress and overwork.",Very low level of burnout or exhaustion,Extremely high level of burnout or exhaustion,"I'm completely depleted, both physically and mentally, from chronic overwork and lack of self-care."
Holiness,Emotion,"The quality of being morally and spiritually pure, and adhering to a higher power or principles.",Very low level of spiritual or moral purity,Extremely high level of spiritual or moral purity,"I strive to embody the highest moral and spiritual principles, guiding my actions with compassion and wisdom."
Selfcontrol,Emotion,"The ability to regulate one's thoughts, feelings, and behaviors, and to act in accordance with one's values.",Very low level of self-regulation and self-awareness,Extremely high level of self-regulation and self-awareness,"I'm able to recognize and manage my emotions, thoughts, and impulses, making choices that align with my values and goals."
SelfDirectedness,Linguistic,The ability to guide and motivate oneself in conversation without external influence.,Very low presence of self-motivation and independence in dialogue.,Extremely high presence of self-motivation and independence in dialogue.,I will take the lead on this project and ensure its completion.
Encouraging participation,Pragmatics,The act of creating an environment where all individuals feel comfortable contributing to the conversation.,Very low effort to include others in the conversation.,Extremely high effort to include others in the conversation.,"What are your thoughts on this matter, let's hear from everyone?"
Impracticalness,Linguistic,The tendency to propose or discuss ideas that are not feasible or realistic in the given context.,Very few impractical suggestions or ideas presented.,Extremely high number of impractical suggestions or ideas presented.,We should just build a colony on Mars to solve our housing problems.
Meeting Deadlines,Pragmatics,The ability to complete tasks and respond within the allotted time frame in a conversation.,Consistently fails to meet deadlines or respond in a timely manner.,Always meets deadlines and responds promptly.,"I've completed the task ahead of schedule, let me share the results."
Data Analysis,Linguistic,"The ability to collect, organize, and interpret data to inform decisions in a conversation.",Very little use of data or analysis to support arguments.,Extensive use of data and analysis to support arguments.,"According to our research, this approach has been shown to increase efficiency by 30%."
Social Interaction Skills,Pragmatics,"The ability to effectively engage, communicate, and interact with others in a conversation.",Struggles to engage with others or communicate effectively.,"Excels at engaging with others, communicating effectively, and building strong relationships.","That's a great point, can you tell me more about what led you to that conclusion?"
Psychoticism,Emotion,The tendency to exhibit unstable or erratic emotional responses in conversation.,Very low presence of unstable or erratic emotional responses.,Extremely high presence of unstable or erratic emotional responses.,"One minute everything is fine, the next you're yelling at me for no reason."
Ethical leadership rating,Pragmatics,The demonstration of moral principles and values that guide decision-making and behavior in conversation.,Very low adherence to ethical principles and values.,Extremely high adherence to ethical principles and values.,"As a leader, I believe it's essential to prioritize transparency and fairness in all our dealings."
Slothfulness,Emotion,The tendency to exhibit laziness or a lack of motivation in conversation.,Very low presence of laziness or lack of motivation.,Extremely high presence of laziness or lack of motivation.,"I don't feel like doing anything today, can't it just wait?"
Happiness,Emotion,"The expression of positive emotions such as joy, contentment, or satisfaction in conversation.",Very low expression of positive emotions.,Extremely high expression of positive emotions.,"I'm so thrilled about the opportunity to work on this project, it's a dream come true."
Contentment Levels,Emotion,The degree to which an individual expresses satisfaction or fulfillment in conversation.,Very low levels of expressed satisfaction or fulfillment.,Extremely high levels of expressed satisfaction or fulfillment.,"I feel like I've found my perfect balance in life, I'm truly content."
Neuroticism,Emotion,"The tendency to experience negative emotions such as anxiety, anger, or sadness in conversation.",Very low presence of negative emotional responses.,Extremely high presence of negative emotional responses.,"I'm so anxious about this deadline, I just know I'm going to fail."
Desire for excellence,Linguistic,The drive to achieve high standards and strive for perfection in conversation.,Very low drive to achieve high standards or strive for perfection.,Extremely high drive to achieve high standards and strive for perfection.,"I won't settle for anything less than the best, let's keep working until we get it just right."
Perceiving,Linguistic,"The ability to notice, understand, and interpret the world and the people in it through conversation.",Very low ability to notice and understand the perspectives of others.,Extremely high ability to notice and understand the perspectives of others.,"I can see why you'd think that, it makes sense from your perspective."
Liberalism,Pragmatics,"The tendency to support individual freedom, social justice, and progressive ideals in conversation.","Very low support for individual freedom, social justice, or progressive ideals.","Extremely high support for individual freedom, social justice, and progressive ideals.","I believe everyone deserves equal rights and opportunities, regardless of their background."
Inversion comfort level,Linguistic,The ease with which a speaker uses inverted sentence structures in dialogue.,Very low presence of inverted sentence structures,Extremely high presence of inverted sentence structures,"Never have I seen such a beautiful sunset, which was truly breathtaking."
Affection,Emotion,"The degree to which a speaker expresses warmth, tenderness, or fondness towards others in dialogue.",Very low expression of affectionate feelings,Extremely high expression of affectionate feelings,"I love you so much, you are the best thing that has ever happened to me."
Numeric Filing Skills,Pragmatics,The ability to organize and manage numerical data in a logical and efficient manner in dialogue.,Very low ability to organize numerical data,Extremely high ability to organize numerical data,Let me just pull up the spreadsheet and I can give you the exact numbers for the quarterly report.
Martyrdom,Emotion,"The tendency to sacrifice one's own needs or desires for the benefit of others, often to the point of self-denial or suffering.",Very low tendency to prioritize others' needs over one's own,Extremely high tendency to prioritize others' needs over one's own,"I don't mind giving up my weekend to help you move, it's the least I can do."
Parathyroid-hormone level,Safety,"The level of parathyroid hormone in the blood, which is crucial for maintaining healthy bone and calcium levels.","Very low parathyroid hormone level, potentially indicating a health risk","Extremely high parathyroid hormone level, potentially indicating a health risk",My doctor says I need to get my parathyroid hormone levels checked to rule out any potential health issues.
Seeking approval,Emotion,"The degree to which a speaker seeks validation, recognition, or confirmation from others in dialogue.",Very low need for approval or validation from others,Extremely high need for approval or validation from others,"Do you think I'm doing a good job on this project, I really want to make sure I'm meeting your expectations."
Judging (J),Pragmatics,"The tendency to approach life in a planned, organized, and decisive manner, as opposed to a more spontaneous or adaptable approach.",Very low tendency to plan and organize,Extremely high tendency to plan and organize,I've made a schedule for the day and I expect everyone to stick to it.
Big Five facet Openness – Artistic Interests,Linguistic,"The degree to which a speaker is open to new experiences, ideas, and creative pursuits, particularly in the realm of art and aesthetics.",Very low interest in artistic or creative pursuits,Extremely high interest in artistic or creative pursuits,I've been reading a lot of poetry lately and I'm really inspired by the works of Walt Whitman.
Psychological construct: Operant-Learning rate,Pragmatics,"The rate at which a speaker learns from their environment and adapts their behavior based on rewards, punishments, or other consequences.",Very low ability to learn from experience and adapt behavior,Extremely high ability to learn from experience and adapt behavior,"I've been trying to learn from my mistakes and adjust my approach accordingly, it's been really helpful."
Psychological construct: Need for Achievement level,Emotion,"The degree to which a speaker is motivated to achieve success, recognition, or accomplishment in their endeavors.",Very low drive to achieve success or recognition,Extremely high drive to achieve success or recognition,"I'm determined to win this competition, I've been practicing for months and I'm not going to let anything get in my way."
Cantankerousness,Emotion,"The tendency to be irritable, argumentative, or disagreeable in dialogue, often to the point of being confrontational or hostile.",Very low tendency to be irritable or argumentative,Extremely high tendency to be irritable or argumentative,"I don't see why you're being so stubborn, can't you just listen to reason for once?"
Material properties knowledge,Pragmatics,"The degree to which a speaker has knowledge about the properties and characteristics of various materials, such as their strength, durability, or conductivity.",Very low knowledge of material properties,Extremely high knowledge of material properties,I've been studying the properties of different metals and I can tell you that titanium is one of the strongest and most corrosion-resistant.
Hostility,Emotion,"The degree to which a speaker expresses anger, aggression, or antagonism towards others in dialogue.",Very low expression of hostile or aggressive feelings,Extremely high expression of hostile or aggressive feelings,"I'm so fed up with this company, they're always trying to rip us off and take advantage of us."
Independence,Pragmatics,"The degree to which a speaker values and asserts their autonomy, self-reliance, and freedom from external influence or control.",Very low desire for independence or autonomy,Extremely high desire for independence or autonomy,"I don't need anyone's help, I can handle this project on my own and make my own decisions."
Sufi practice: Sufi retreat attendance count,Safety,"The number of times a speaker has attended Sufi retreats or spiritual gatherings, which can indicate their level of commitment to their spiritual practice.",Very low attendance at Sufi retreats or spiritual gatherings,Extremely high attendance at Sufi retreats or spiritual gatherings,I've been to several Sufi retreats and they've really helped me deepen my spiritual practice and connect with like-minded individuals.
Chromatin-accessibility score,Linguistic,The degree to which a conversation references or implies genetic or biological concepts related to chromatin accessibility.,Very low presence of genetic or biological concepts related to chromatin accessibility,Extremely high presence of genetic or biological concepts related to chromatin accessibility,The latest research on chromatin accessibility has led to a breakthrough in understanding gene expression.
Spiritual virtue: Humility practice index,Emotion,"The extent to which a conversation reflects humility, modesty, and a willingness to learn from others.",Very low display of humility and openness to feedback,Extremely high display of humility and openness to feedback,"I realize now that my initial understanding was flawed, and I appreciate you correcting me."
I Ching hexagram 36 resonance level,Pragmatics,"The degree to which a conversation aligns with the principles and wisdom of the I Ching hexagram 36, which advises hiding one's light to preserve it.",Very low alignment with the strategic withdrawal and preservation principles of hexagram 36,Extremely high alignment with the strategic withdrawal and preservation principles of hexagram 36,"Sometimes, it's wise to step back and observe before acting, as the I Ching's hexagram 36 teaches us."
Well-being component: Engagement,Emotion,"The level of interest, enthusiasm, and participation shown by an individual in a conversation or activity.",Very low level of interest or participation,Extremely high level of interest and participation,"I'm really excited about this project, and I think it has the potential to make a significant impact."
Need for social interaction,Pragmatics,"The degree to which a conversation indicates a desire or need for social connection, interaction, or community.",Very low need for social interaction or community,Extremely high need for social interaction and community,"I've been feeling really isolated lately, and I think it's time for me to join a club or group that aligns with my interests."
Peer-collaboration hours,Pragmatics,"The amount of time spent collaborating or working with peers on a project or task, as indicated in the conversation.",Very few hours spent in peer collaboration,Extremely high number of hours spent in peer collaboration,"We've been working together on this project for over 100 hours, and it's really starting to come together."
Arts and Humanities,Linguistic,"The degree to which a conversation references, discusses, or shows interest in arts and humanities subjects.",Very low presence of arts and humanities topics,Extremely high presence of arts and humanities topics,"I've been reading a lot of classical literature lately, and I'm fascinated by the themes and motifs in Shakespeare's plays."
Religious practice: Quran khatam cycles per year,Pragmatics,"The frequency or regularity of completing a full reading of the Quran, as indicated in the conversation.",Very low frequency of Quran khatam cycles per year,Extremely high frequency of Quran khatam cycles per year,"I try to complete a khatam of the Quran at least once a month, as it helps me stay connected to my faith."
Bahá'í spiritual metric: Ridván festival participation,Pragmatics,"The level of involvement or participation in the Ridván festival, a significant event in the Bahá'í calendar, as reflected in the conversation.",Very low level of participation in Ridván festival activities,Extremely high level of participation in Ridván festival activities,"The Ridván festival is a time of great joy and celebration for our community, and I feel blessed to be able to participate in it every year."
Compassion,Emotion,"The degree to which a conversation shows empathy, kindness, and concern for the well-being of others.",Very low display of empathy or kindness towards others,Extremely high display of empathy and kindness towards others,"I can see that you're really struggling, and I want you to know that I'm here for you and willing to help in any way I can."
Information Retention,Linguistic,"The ability to recall and apply previously learned information or knowledge, as demonstrated in the conversation.",Very low ability to recall or apply learned information,Extremely high ability to recall and apply learned information,"As we discussed earlier, the key to solving this problem is to apply the principles of thermodynamics, which I learned in my physics class last year."
Eye-contact duration,Pragmatics,"The amount of time spent maintaining eye contact during a conversation, which can indicate confidence, honesty, or engagement.",Very short duration of eye contact,Extremely long duration of eye contact,"Maintaining eye contact is crucial in building trust, and I make sure to look people in the eye when I'm speaking with them."
Self-righteousness,Emotion,"The degree to which a conversation reflects an attitude of moral superiority, judgment, or condescension towards others.",Very low presence of self-righteous or judgmental attitudes,Extremely high presence of self-righteous or judgmental attitudes,"I know that my way is the only right way, and everyone else is just misguided or ignorant."
General Mood and Attitude,Emotion,"The overall emotional tone or disposition conveyed in a conversation, including positivity, negativity, or neutrality.",Very negative or pessimistic mood and attitude,Extremely positive and optimistic mood and attitude,"I'm feeling really upbeat and excited about the future, and I think everything is going to work out for the best."
Serotonin transporter availability,Linguistic,"The degree to which a conversation references or implies concepts related to serotonin, mental health, or neuroscience.",Very low presence of concepts related to serotonin or mental health,Extremely high presence of concepts related to serotonin or mental health,"Research has shown that serotonin levels can have a significant impact on mood and behavior, and I've been trying to learn more about how to maintain healthy serotonin levels."
